{
  "schema_version": "1.0",
  "source_duration": 191.22,
  "assets_are_real": true,
  "segments": [
    {
      "segment_id": "s1",
      "start": 10.7,
      "end": 25.46,
      "transcript": "То есть, это масса свидетельств совершенно разных, которые бьют в одну точку, что 13,8 миллиарда лет назад был большой взрыв. Мы знаем уже многие этапы большого взрыва.",
      "frame_paths": [
        "frames/s1.jpg",
        "frames/s1_2.jpg"
      ]
    },
    {
      "segment_id": "s2",
      "start": 28.76,
      "end": 34.16,
      "transcript": "Ну, то есть, то, что галактики разбегаются, это прекрасно видно. Красное смещение там, это все.",
      "frame_paths": [
        "frames/s2.jpg"
      ]
    },
    {
      "segment_id": "s3",
      "start": 35.28,
      "end": 44.56,
      "transcript": "Прекрасно видно, что Вселенная эволюционирует, что там, скажем, 12 миллиардов лет назад она выглядела совершенно по-другому, что она была совершенно другой плотности.",
      "frame_paths": [
        "frames/s3.jpg",
        "frames/s3_2.jpg"
      ]
    },
    {
      "segment_id": "s4",
      "start": 45.12,
      "end": 49.32,
      "transcript": "Галактики выглядели совершенно иначе, что Вселенная эволюционирует.",
      "frame_paths": [
        "frames/s4.jpg"
      ]
    },
    {
      "segment_id": "s5",
      "start": 49.62,
      "end": 57.08,
      "transcript": "Дальше идут более тонкие вещи, такие как реликтовые излучения, по которым мы видим, что у Вселенной было другое физическое состояние.",
      "frame_paths": [
        "frames/s5.jpg"
      ]
    },
    {
      "segment_id": "s6",
      "start": 57.92,
      "end": 63.84,
      "transcript": "И дальше начинаются всякие более тонкие вещи, типа мы видим неоднородности в ранней Вселенной.",
      "frame_paths": [
        "frames/s6.jpg"
      ]
    },
    {
      "segment_id": "s7",
      "start": 66.48,
      "end": 74.4,
      "transcript": "слишком много свидетельств, которые бьют в одну точку. И главное, что они не только бьют в одну точку, но и все концы с концами сходятся.",
      "frame_paths": [
        "frames/s7.jpg"
      ]
    },
    {
      "segment_id": "s8",
      "start": 75.71,
      "end": 84.99,
      "transcript": "Например, измерения реликтового излучения согласуются с измерениями химического состава Вселенной первоначального.",
      "frame_paths": [
        "frames/s8.jpg"
      ]
    },
    {
      "segment_id": "s9",
      "start": 87.17,
      "end": 93.97,
      "transcript": "Измерения реликтового излучения согласуются с теорией возникновения галактик.",
      "frame_paths": [
        "frames/s9.jpg"
      ]
    },
    {
      "segment_id": "s10",
      "start": 95.85,
      "end": 103.39,
      "transcript": "Прецизионные измерения реликтового излучения согласуются с теорией инфляции.",
      "frame_paths": [
        "frames/s10.jpg"
      ]
    },
    {
      "segment_id": "s11",
      "start": 103.53,
      "end": 119.69,
      "transcript": "Причем теория инфляции возникла независимо. Она предсказала, что в спектре реликтового излучения есть такая особенность будет, и она была найдена, но не сразу после того, как было обнаружено реликтовое излучение, а много спустя, когда его стали уже очень точно измерять.",
      "frame_paths": [
        "frames/s11.jpg"
      ]
    },
    {
      "segment_id": "s12",
      "start": 120.05,
      "end": 130.63,
      "transcript": "Это особенность, связанная с соотношением крупномасштабных и мелкомасштабных неоднородностей в реликтовом излучении. Все бьет в одну точку.",
      "frame_paths": [
        "frames/s12.jpg"
      ]
    },
    {
      "segment_id": "s13",
      "start": 132.0,
      "end": 145.24,
      "transcript": "Так что вариантов, кроме большого взрыва, это все равно, что вариантов, кроме шарообразности Земли, это плоская Земля, а так и здесь. Стационарная Вселенная уже не лезет в никакие ворота. Просто.",
      "frame_paths": [
        "frames/s13.jpg"
      ]
    },
    {
      "segment_id": "s14",
      "start": 151.5,
      "end": 159.98,
      "transcript": "была теория стационарной Вселенной Фреда Хойла, которая продержалась довольно долго. Это стало ясно после открытия реликтового излучения, особенно после открытия его неоднородностей.",
      "frame_paths": [
        "frames/s14.jpg",
        "frames/s14_2.jpg"
      ]
    },
    {
      "segment_id": "s15",
      "start": 159.98,
      "end": 168.58,
      "transcript": "Дальше уже стало просто неприлично опровергать теорию большого взрыва и заниматься стационарной Вселенной. Хотя продолжали.",
      "frame_paths": [
        "frames/s15.jpg"
      ]
    }
  ]
}
