{
  "schema_version": "1.0",
  "source_duration": 191.22,
  "assets_are_real": true,
  "segments": [
    {
      "segment_id": "s1",
      "start": 10.7,
      "end": 22.56,
      "transcript": "То есть, это масса свидетельств совершенно разных, которые бьют в одну точку, что 13,8 миллиарда лет назад был большой взрыв.",
      "frame_paths": [
        "frames/s1.jpg",
        "frames/s1_2.jpg"
      ]
    },
    {
      "segment_id": "s2",
      "start": 28.76,
      "end": 34.16,
      "transcript": "Ну, то есть, то, что галактики разбегаются, это прекрасно видно. Красное смещение там, это все.",
      "frame_paths": [
        "frames/s2.jpg"
      ]
    },
    {
      "segment_id": "s3",
      "start": 35.28,
      "end": 44.56,
      "transcript": "Прекрасно видно, что Вселенная эволюционирует, что там, скажем, 12 миллиардов лет назад она выглядела совершенно по-другому, что она была совершенно другой плотности.",
      "frame_paths": [
        "frames/s3.jpg"
      ]
    },
    {
      "segment_id": "s4",
      "start": 49.62,
      "end": 57.08,
      "transcript": "Дальше идут более тонкие вещи, такие как реликтовые излучения, по которым мы видим, что у Вселенной было другое физическое состояние.",
      "frame_paths": [
        "frames/s4.jpg"
      ]
    },
    {
      "segment_id": "s5",
      "start": 66.48,
      "end": 74.4,
      "transcript": "слишком много свидетельств, которые бьют в одну точку. И главное, что они не только бьют в одну точку, но и все концы с концами сходятся.",
      "frame_paths": [
        "frames/s5.jpg"
      ]
    },
    {
      "segment_id": "s6",
      "start": 95.85,
      "end": 106.73,
      "transcript": "Прецизионные измерения реликтового излучения согласуются с теорией инфляции. Причем теория инфляции возникла независимо.",
      "frame_paths": [
        "frames/s6.jpg"
      ]
    },
    {
      "segment_id": "s7",
      "start": 151.5,
      "end": 159.98,
      "transcript": "была теория стационарной Вселенной Фреда Хойла, которая продержалась довольно долго. Это стало ясно после открытия реликтового излучения, особенно после открытия его неоднородностей.",
      "frame_paths": [
        "frames/s7.jpg",
        "frames/s7_2.jpg"
      ]
    },
    {
      "segment_id": "s8",
      "start": 159.98,
      "end": 168.58,
      "transcript": "Дальше уже стало просто неприлично опровергать теорию большого взрыва и заниматься стационарной Вселенной. Хотя продолжали.",
      "frame_paths": [
        "frames/s8.jpg"
      ]
    }
  ]
}
